{"asi": {"evidence": "The no-module path is proven borrowed by a focused test. The custom-module 40-run repeat measured 22.61 milliseconds versus 22.51 milliseconds immediately before this treatment, effectively flat under current host noise. Module tests, strict linting, and formatting passed.", "hypothesis": "Clone-on-write module composition can remove the temporary built-in source copy when no custom modules exist, while exact capacity avoids repeated growth when files are appended.", "next": "Run complete workspace validation, update the benchmark report with resident-memory and traversal results, and ask Claude to challenge the retained design."}, "commit": "e7ca5b5", "confidence": 4.176707370842155, "description": "perf(frontend): borrow unchanged module source", "metric": 22.61238012, "metrics": {"branches": 5000.0, "mean_ms": 23.27653412, "small_fixture_repeat_ms": 22.50535072, "stddev_ms": 3.46453693, "unpruned_large_workspace_median_ms": 127.61449872}, "run": 25, "segment": 11, "status": "keep", "timestamp": 1785089963290}
{"bestDirection": "lower", "maxIterations": 2, "metricName": "local_hit_ms", "metricUnit": "ms", "name": "Pre-size analysis module source", "timestamp": 1785090329432, "type": "config"}
{"asi": {"evidence": "Two 40-run treatments measured 20.69 and 19.05 milliseconds median versus the preceding 22.61-millisecond repeat. The stable treatment is 15.7 percent lower. The source now reserves the exact selected prelude size, borrows index path strings, and reuses the first output metadata lookup. Focused tests, strict linting, formatting, full workspace tests, and 241 command-line specifications passed.", "hypothesis": "The graph-build path knows all selected prelude lengths in advance and can avoid repeated String growth plus cloned static path names.", "next": "Retain bounded portable I/O. Design remote stream-to-cache as a separate change before replacing capture buffering, because generic put_stream intentionally limits very large remote uploads today."}, "commit": "5e5c8b6", "confidence": null, "description": "perf(frontend): pre-size selected module source", "metric": 19.05348426, "metrics": {"first_treatment_median_ms": 20.6908135, "mean_ms": 19.448197635, "preceding_repeat_median_ms": 22.61238012, "stddev_ms": 1.880332101}, "run": 26, "segment": 12, "status": "keep", "timestamp": 1785090463515}
{"bestDirection": "lower", "maxIterations": 12, "metricName": "warm_elapsed_seconds", "metricUnit": "seconds", "name": "Outperform Bazel on the Codex build", "timestamp": 1785239365110, "type": "config"}
{"asi":{"evidence":"Ten final end-to-end receipt hits measured 0.0556 seconds median versus Bazel's 0.7281 seconds. Prepared launchers measured 0.0227 versus 0.5208 seconds. The tracker used 11.3 mebibytes versus Bazel's 2163.6 mebibytes. Full workspace tests, strict linting, formatting, adapter checks, deliberate source/output invalidations, host-tool invalidation, and executable startup validation passed.","hypothesis":"Persistent source digests, immutable provider sharing, batched evidence, and a kernel-event receipt boundary can make unchanged builds proportional to relevant changes while retaining conservative fallback paths.","next":"Keep the warm-path changes. For cold work, add changed-path reconciliation, pipeline dependency fetching with analysis, then benchmark a memory-aware critical-path scheduler and lazy intermediate materialization on equivalent native dependency strategies."},"commit":null,"confidence":null,"description":"Once outperforms Bazel on unchanged Codex builds","metric":0.055632042,"metrics":{"bazel_warm_median_seconds":0.728093542,"once_prepared_median_seconds":0.0227155,"bazel_prepared_median_seconds":0.520765375,"once_cold_seconds":311.624465833,"bazel_cold_reference_seconds":2795.311,"once_tracker_resident_kibibytes":11584,"bazel_service_resident_kibibytes":2215536,"once_cold_peak_resident_kibibytes":7785904},"run":27,"segment":13,"status":"keep","timestamp":1785247044000}
{"experiment_id":"rebase-bounded-memory","timestamp":"2026-07-29T09:25:00Z","hypothesis":"Campaign changes can be merged onto the bounded-memory main without losing correctness or the retained optimizations","control":"pre-rebase worktree at 9da652a with uncommitted campaign changes","treatment":"rebased onto 85e17b4 with 6 conflict files resolved","primary_metric":"compilation_and_test_status","result":"keep","measurements":{"conflicts_resolved":6,"tests_passed":298,"tests_failed":0,"clippy_clean":true,"fmt_clean":true,"release_build_seconds":285},"notes":"scheduler materialize_cached_outputs restored for correctness with Starlark targets that consume undeclared dependency outputs"}
{"experiment_id":"lazy-materialization-transitive-artifacts","timestamp":"2026-07-29T08:27:00Z","hypothesis":"Carrying transitive artifact identities through BuildOutcome and skipping intermediate output materialization improves complete-cache empty-output-tree builds","control":"eager materialization: 47.799 seconds, 3.7 GiB output tree","treatment":"lazy transitive artifacts: 8.870 seconds, 658 MiB output tree","primary_metric":"warm_elapsed_seconds","result":"keep","measurements":{"eager_control_seconds":47.799,"lazy_treatment_seconds":8.870,"improvement_factor":5.4,"eager_output_gib":3.7,"lazy_output_mib":658,"output_reduction_pct":82,"receipt_followup_seconds":0.297},"notes":"binary-change confound: control used old binary without transitive artifacts, treatment used pre-rebase binary with transitive artifacts; scheduler materialize_cached_outputs restored in rebased code for Starlark correctness, so rebased binary cannot achieve this without further work"}
{"experiment_id":"changed-path-reconciliation","timestamp":"2026-07-28T16:00:00Z","hypothesis":"Storing only changed source paths in build receipts enables receipt reconciliation when transient compiler files appear during builds","control":"receipt always falls back to full validation when source generation changes","treatment":"receipt reconciles when observed inputs still match and unobserved changed paths no longer exist","primary_metric":"warm_elapsed_seconds","result":"keep","measurements":{"receipt_bytes":6047,"warm_median_seconds":0.0591},"notes":"safe rule: observed input must match digest, unobserved changed path may reconcile only when it no longer exists"}
{"experiment_id":"naive-all-source-receipt","timestamp":"2026-07-28T15:30:00Z","hypothesis":"Storing all 44026 observed source digests in the receipt enables complete reconciliation","control":"standard receipt validation","treatment":"receipt with all source digests","primary_metric":"receipt_path_seconds","result":"discard","measurements":{"receipt_path_seconds":0.34,"digest_count":44026},"notes":"receipt path took 0.2 to 0.4 seconds; discarded in favor of storing only changed paths"}
{"experiment_id":"first-lazy-materialization","timestamp":"2026-07-28T17:00:00Z","hypothesis":"Skipping cache-hit materialization entirely improves empty-output-tree builds","control":"eager materialization of all cached outputs","treatment":"skip materialization on cache hits without transitive artifact identities","primary_metric":"build_success","result":"discard","measurements":{"failure_after_seconds":3.7,"missing_artifact":"scopeguard-1.2.0/libscopeguard"},"notes":"failed because direct-dependency artifact table lacked transitive artifact identities"}
{"experiment_id":"critical-depth-scheduling","timestamp":"2026-07-28T17:30:00Z","hypothesis":"Binary-heap ready queue with longest-remaining-dependent-chain ordering improves cold build wall time","control":"nondeterministic hash iteration ready queue, 311.624 seconds","treatment":"critical-depth binary heap, 301.923 seconds","primary_metric":"cold_elapsed_seconds","result":"keep","measurements":{"control_seconds":311.624,"treatment_seconds":301.923,"improvement_seconds":9.701,"improvement_pct":3.1},"notes":"background processor load was high; keep as promising evidence, not a definitive improvement"}
