{"run":61,"commit":"6b7db08","metric":31.77554832,"metrics":{"mean_ms":31.66756191999999,"stddev_ms":1.5157252095632565,"process_floor_ms":6.25766268,"control_local_hit_ms":32.798654479999996,"graph_hit_ms":162.11002186000002},"status":"keep","description":"perf(cli): start host sampling only after event-service readiness during parallel preflight","timestamp":1791364601569,"segment":13,"confidence":222.95704748737307,"asi":{"hypothesis":"With the filesystem barrier and dedicated reporting preflight now concurrent, skip unobserved sampler initialization until event readiness so it cannot delay IPC progress on the invocation thread.","revisits_run":48,"changed_assumption":"Run 59 introduced a parallel filesystem barrier while restoring discovery to a dedicated runtime. Earlier standalone sampling attempts had no concurrent barrier on the critical path.","evidence":"Median 31.78 ms versus matched overlap-only control 32.80 ms, a 1.02 ms reduction. Seven signal tests, 25 event transport tests and automatic reporter/sampler/graph/module checks and strict lint passed.","paired_delta_ms":-1.023106159999997,"control_commit":"afa795b","diagnostics":{"preflight_ms":4.762172698974609,"receipt_ms":6.159067153930664,"session_ms":11.021137237548828},"behavior":"Connected streams still start and drain host sampling before run events are published. Missing or failed preflight does not construct an unobserved sampler; no transport, authentication or signal behavior is weakened.","noise_note":"Host load raised both medians relative to historical controls; only the fresh paired delta supports this candidate. Reverse-order confirmation is required.","next_action_hint":"Verify in reverse order against afa795b. Remove the composed sampling change if its gain does not persist."}}
{"run":62,"commit":"6b7db08","metric":30.077855540000005,"metrics":{"mean_ms":29.73870996500001,"stddev_ms":2.562936806556413,"process_floor_ms":6.716602520000002,"control_local_hit_ms":29.6463775,"graph_hit_ms":161.29120954},"status":"discard","description":"Reverse-order verification does not confirm connected-only sampling composition gain","timestamp":1791365099600,"segment":13,"confidence":234.07019503713508,"asi":{"hypothesis":"Verify the composed sampling change with treatment-first measurement order against overlap-only commit afa795b.","rollback_reason":"No source changes in this verification. Treatment 30.08 ms is above matched control 29.65 ms, reversing the previous 1.02 ms apparent improvement.","paired_delta_ms":0.43147804000000534,"control_commit":"afa795b","evidence":"Automatic reporter, sampler, graph, module, formatting and strict lint checks passed. Graph fallback remained 161.29 ms.","next_action_hint":"Remove connected-only sampling unless an additional controlled comparison shows a consistent improvement. Do not attribute earlier host-driven measurements to this composition.","learning":"Scheduling interactions are subtler than nominal phase timings imply; even the composition lacks reproducible benefit across orderings."}}
{"run":63,"commit":"6b7db08","metric":30.34559516,"metrics":{"mean_ms":30.496001084999993,"stddev_ms":0.9380193382411715,"process_floor_ms":6.50796482,"control_local_hit_ms":29.89962616,"graph_hit_ms":154.63077634},"status":"discard","description":"Restoring eager host sampling during parallel preflight was slightly slower in a fresh paired comparison","timestamp":1791365542718,"segment":13,"confidence":237.50596211244928,"asi":{"hypothesis":"Simplify sampling readiness after the previous reverse-order trial failed to confirm a benefit.","rollback_reason":"Eager sampling restoration measured 30.35 ms versus connected-only control 29.90 ms; primary worsened, so restore the retained readiness-gated sampler.","paired_delta_ms":0.4459690000000016,"control_commit":"6b7db08","evidence":"Sampler, reporter, graph, module and strict lint checks plus all seven signal integration tests passed. Full graph fallback stayed healthy at 154.63 ms.","noise_note":"Two comparisons favor readiness-gated sampling and one favors eager sampling, all small relative to paired noise. No strong sub-millisecond claim is justified.","next_action_hint":"Do not keep cycling sampling policies. Preserve the current validated composition and seek a structurally different hypothesis or collect enough independent paired samples to resolve uncertainty."}}
{"run":64,"commit":"49d911f","metric":24.76101188,"metrics":{"control_local_hit_ms":25.0046423,"mean_ms":24.609962754999998,"stddev_ms":1.6041336573550509,"process_floor_ms":2.650314,"graph_hit_ms":112.55402110000001},"status":"keep","description":"perf(cli): evaluate responsive I/O polling with a modular startup entrypoint","timestamp":1791366234028,"segment":13,"confidence":234.07019503713508,"asi":{"hypothesis":"Poll Tokio I/O every scheduling turn on the current-thread CLI runtime to reduce readiness latency in I/O-oriented commands; preserve the blocking pool and all action resource admission.","implementation":"Explicit current-thread runtime with event_interval(1). Split the oversized entrypoint into startup and error-rendering modules, retaining all seven error tests next to their implementation.","paired_delta_ms":-0.2436304200000028,"control_commit":"6b7db08","evidence":"Primary 24.76 ms versus fresh 25.00 ms control. Seven error-format tests, seven signal tests and all focused backpressure checks passed.","noise_note":"The 0.24 ms paired difference is below the previous identical-code noise floor. The much lower process floor and graph-hit timing indicate host drift, not a proven runtime gain. Treat as provisional until reverse-order validation.","next_action_hint":"Run treatment-first comparison against 6b7db08. If no consistent advantage remains, restore default event polling rather than retaining a speculative scheduler tuning."}}
{"run":65,"commit":"97c4d61","metric":24.852583340000006,"metrics":{"mean_ms":25.064628190000004,"stddev_ms":1.8628541200418933,"process_floor_ms":4.556468439999999,"control_local_hit_ms":25.4505392,"graph_hit_ms":112.62714952},"status":"keep","description":"Verify modular startup and frequent I/O polling in reverse measurement order","timestamp":1791366610166,"segment":13,"confidence":222.95704748737307,"asi":{"hypothesis":"Reverse measurement order to distinguish a reproducible small startup improvement from host drift.","control_commit":"6b7db08","paired_delta_ms":-0.5979558599999955,"evidence":"Both orders favored the candidate: 0.24 ms and 0.60 ms. Full graph fallback stayed at 112.63 ms, and all focused backpressure checks passed.","noise_note":"The average advantage is about 0.42 ms, near the prior paired noise floor. The candidate also includes the required entrypoint modularization, so polling-specific attribution needs an isolated comparison.","next_action_hint":"Restore the default event interval while retaining the modular source layout, then compare against 49d911f to isolate whether scheduler tuning actually contributes."}}
{"run":66,"commit":"9899179","metric":24.38821016,"metrics":{"control_local_hit_ms":24.65588564,"mean_ms":23.953234960000007,"stddev_ms":2.6453829471572003,"process_floor_ms":4.5473738,"graph_hit_ms":107.71121794000003},"status":"keep","description":"perf(cli): preserve default Tokio event polling after isolating scheduler tuning","timestamp":1791367595688,"segment":13,"confidence":201.33681473280743,"asi":{"hypothesis":"Remove speculative event_interval(1) while retaining the modular startup layout, isolating the scheduler setting from the source refactor.","control_commit":"49d911f","paired_delta_ms":-0.2676754800000012,"evidence":"Default polling measured 24.39 ms versus frequent-poll control 24.66 ms. All seven error tests, all seven signal tests and automatic correctness and strict lint checks passed.","noise_note":"The small gain is below the previous paired noise floor. Frequent polling is not established as the reason for earlier gains; prefer the default scheduling policy.","secondary_warning":"Graph median was 107.71 ms but mean 140.94 ms and standard deviation 105.96 ms showed large host outliers. Investigate with a repeat rather than attributing outliers to this one-line policy restoration.","next_action_hint":"Verify default polling in reverse order and run full workspace tests, strict workspace clippy and ShellSpec against the modularized entrypoint and retained reporting composition."}}
{"run":67,"commit":"9899179","metric":0,"metrics":{"mean_ms":24.71491819500001,"stddev_ms":1.980512475732235,"process_floor_ms":4.1928858400000015,"control_local_hit_ms":24.465970300000006,"graph_hit_ms":113.63134356000002},"status":"crash","description":"Late-service sampling regression tests passed, but strict workspace Clippy rejected a value-taking readiness helper","timestamp":1791368433622,"segment":13,"confidence":201.33681473280743,"asi":{"hypothesis":"Preserve host sampling when bounded preflight times out, because the background reporter may still connect after the caller resumes.","rollback_reason":"Strict workspace Clippy failed with needless_pass_by_value in the new readiness policy helper; take the small result by reference instead. All workspace tests completed successfully, but ShellSpec was not reached.","next_action_hint":"Retry the correctness guard with a borrowed readiness result, rerun full strict lint and ShellSpec, and compare fresh paired latency. Do not leave the readiness-timeout sampling hole in the final implementation.","correctness_finding":"Ok(Err(RecvError)) confirms a completed preflight without streaming; Err(Elapsed) does not. A timeout can be followed by a late live connection and must retain sampling.","tests":"Added and passed ready, unavailable and pending-timeout policy tests; the entire workspace test suite passed before linting failed.","benchmark_primary_before_lint_failure_ms":24.996910920000005}}
{"run":68,"commit":"9899179","metric":25.592132680000006,"metrics":{"mean_ms":25.282908555000002,"stddev_ms":1.6807548316318794,"process_floor_ms":4.11762502,"control_local_hit_ms":25.545361500000002,"graph_hit_ms":116.92666002000001},"status":"discard","description":"Borrowed late-service readiness guard passes full validation but is indistinguishable from the previous policy in paired latency","timestamp":1791369975888,"segment":13,"confidence":192.47588824659417,"asi":{"hypothesis":"Repair the late-connection sampling guard with a borrowed readiness result so strict workspace linting passes.","revisits_run":67,"changed_assumption":"The helper now borrows rather than consumes the readiness result, fixing the strict Clippy failure.","rollback_reason":"Primary 25.59 ms is slightly above matched 25.55 ms control, a 0.047 ms difference. The metric did not improve, so the change is reverted despite passing correctness checks.","next_action_hint":"The retained readiness-gated control has a known late-connection sampling hole. Compare the repaired composition against the last semantically correct overlap-only control afa795b instead of treating the unsafe intermediate policy as the performance baseline. Do not hand off the known bug.","validation":"Full workspace tests, strict workspace Clippy, all focused backpressure checks and ShellSpec passed. ShellSpec skipped unavailable Docker, Microsandbox and gated remote/native integrations.","paired_delta_ms":0.04677118000000413,"control_commit":"9899179","correctness_finding":"A readiness timeout is not a confirmed unavailable service; the background worker can still connect later."}}
