{"run":46,"commit":"0abbd82","metric":26.269747100000004,"metrics":{"mean_ms":27.670722675000007,"stddev_ms":3.847140172874891,"process_floor_ms":4.072175180000002},"status":"keep","description":"perf(cli): defer dedicated event runtime until discovery finds a service","timestamp":1791358276881,"segment":13,"confidence":314.0148821047657,"asi":{"hypothesis":"Perform bounded discovery before creating a dedicated blocking worker/runtime, while preserving that runtime for actual streaming and retaining sampler semantics.","evidence":"Median improved from last validated 30.06 ms to 26.27 ms. Seven reporter tests, seven signal integration tests, focused graph/module/sampler checks and strict CLI clippy passed.","diagnostics":{"direct_median_ms":20.43395849999999,"wrapper_median_ms":27.47012499999998,"wrapper_overhead_ms":7.036166499999993,"preflight_ms":4.0149688720703125,"receipt_ms":7.093906402587891,"session_ms":11.36016845703125,"phase_samples":23},"validation_detail":"A regression test saturates the runtime's single blocking worker and proves that no-event-service startup and finish still complete promptly. Existing 12-second total preflight bound now spans discovery and readiness.","noise_note":"Process-floor median also dropped from 7.15 ms to 4.07 ms, so a verification repeat is needed to separate host drift from the event-runtime saving.","next_action_hint":"Repeat the retained treatment immediately, then consider a paired control if phase timings do not corroborate a real saving.","scope_note":"Generic event-reporting startup adjacent to graph orchestration; HTTP and HTTPS discovery, proxy TLS trust, authentication and signal draining are unchanged."}}
{"run":47,"commit":"227c580","metric":24.23830302,"metrics":{"mean_ms":24.73954912,"stddev_ms":1.9245275046292138,"process_floor_ms":3.67116126},"status":"keep","description":"Verify deferred event runtime with another 40 warmed release invocations","timestamp":1791358319074,"segment":13,"confidence":289.73767621312203,"asi":{"hypothesis":"Repeat the retained startup treatment without rebuilding source to confirm that the initial improvement persists.","evidence":"Second 40-run median improved to 24.24 ms with 1.92 ms standard deviation; no code changes, all automatic correctness checks passed.","noise_note":"Host process floor remains lower than old controls. Pair a fresh original-startup control against this treatment before assigning the exact performance gain.","diagnostics":{"direct_median_ms":11.193270499999992,"wrapper_median_ms":25.622291499999978,"wrapper_overhead_ms":14.429020999999986,"preflight_ms":3.7331581115722656,"receipt_ms":7.177114486694336,"session_ms":11.268138885498047,"phase_samples":23},"diagnostic_caution":"Wrapper/direct difference includes differing syscall scheduling and tracker waits; it is not a pure shell-overhead estimate and must not be used to justify benchmark changes.","next_action_hint":"Use a fresh paired control of old dedicated-runtime ordering, then restore retained treatment if the control is slower."}}
{"run":48,"commit":"227c580","metric":24.795062080000005,"metrics":{"mean_ms":24.554805130000002,"stddev_ms":0.8941694353508105,"process_floor_ms":3.7780501799999997},"status":"discard","description":"Connected-only sampling retry after moving discovery onto the invocation runtime still does not improve hits","timestamp":1791358618370,"segment":13,"confidence":267.0813322270319,"asi":{"hypothesis":"With discovery now on the invocation runtime, avoiding unobserved sysinfo setup might prevent it from blocking discovery on the same async thread.","revisits_run":35,"rollback_reason":"24.80 ms median is worse than retained 24.24 ms; removing sampler setup still yields no primary improvement even after the runtime architecture changed.","evidence":"Reporter, seven spawned cancellation tests, 25 event-service transport tests, and all focused strict checks passed. Process floor is comparable to previous 3.67 ms control.","next_action_hint":"Close connected-only sampling hypothesis for this workload. Seek a different structural source of cost rather than retrying sampling or configuration deduplication.","changed_assumption":"Run 46 moved discovery off its dedicated blocking runtime onto the invocation runtime, making sampler initialization contend with discovery rather than run independently."}}
{"run":49,"commit":"227c580","metric":25.074316959999997,"metrics":{"mean_ms":25.017118735,"stddev_ms":0.9690145002934545,"process_floor_ms":3.7004142799999995},"status":"discard","description":"Release optimization level 2 did not improve startup or local-hit median","timestamp":1791358879243,"segment":13,"confidence":355.62621464209286,"asi":{"hypothesis":"Less aggressive release optimization may reduce instruction-cache pressure and improve short-lived CLI startup while retaining thin LTO.","rollback_reason":"25.07 ms is slower than retained 24.24 ms and process floor remains unchanged at 3.70 ms; no measurable startup benefit.","next_action_hint":"Keep release level 3. Investigate a different operation rather than compiler knobs now that both full LTO and lower optimization level failed.","evidence":"Focused tests, sampler regressions, formatting and strict CLI clippy passed. Diagnostics continue to attribute roughly 3.7 ms to reporting preflight and 7.45 ms to receipt/tracker validation."}}
{"run":50,"commit":"227c580","metric":24.156986900000003,"metrics":{"mean_ms":24.18416982500001,"stddev_ms":0.9705826668556814,"process_floor_ms":3.9263371600000005},"status":"checks_failed","description":"Discovery phase profiling identifies client construction as dominant preflight work; formatting check failed","timestamp":1791359148092,"segment":13,"confidence":276.3844503885827,"asi":{"hypothesis":"Measure discovery client construction separately from request transport before pursuing TLS or proxy optimization.","rollback_reason":"Profiling-only code failed rustfmt because its send expression should be one line. No behavior changes should be retained from this profiling run.","diagnostics":{"discovery_client_ms":2.379,"discovery_request_ms":0.89,"preflight_ms":3.7469863891601562,"receipt_ms":7.208824157714844,"session_ms":11.012077331542969,"phase_samples":23},"next_action_hint":"Client construction costs about 2.38 ms. Source inspection shows platform TLS verifier construction is trivial on this host, while Microsandbox transitively enables reqwest system-proxy support. Preserve proxy semantics; investigate lazy or lower-cost equivalent client initialization.","evidence":"Benchmark passed, 14 module tests and 18 graph tests passed; formatting rejected temporary profiling code. Primary's tiny 0.08 ms apparent gain is not an optimization finding."}}
{"run":51,"commit":"227c580","metric":24.238806200000003,"metrics":{"mean_ms":23.942175625,"stddev_ms":1.3318817371681677,"process_floor_ms":4.402425020000002},"status":"discard","description":"Disabling idle pooling for the one-request discovery client did not improve median latency","timestamp":1791359369054,"segment":13,"confidence":250.30046780866218,"asi":{"hypothesis":"Discovery creates a fresh client for one bounded request, so allocating and managing an idle connection pool cannot provide reuse.","rollback_reason":"24.238806 ms is unchanged/slightly above retained 24.238303 ms; primary improvement absent despite lower mean. Avoid retaining a noise-only change.","next_action_hint":"Do not tune connection pooling further. Client construction remains a 2.38 ms cost, likely dominated by system-proxy setup rather than pooled connection management.","evidence":"Seven spawned cancellation tests, 25 event transport tests, focused graph/module/sampler checks and strict CLI lint all passed. TLS verification and proxy semantics were unchanged."}}
{"run":52,"commit":"227c580","metric":24.96070998,"metrics":{"mean_ms":25.00895993,"stddev_ms":1.0047463995402137,"process_floor_ms":4.020026800000001},"status":"discard","description":"Full workspace validation passes after deferred event runtime; repeat remains near 25 ms","timestamp":1791359733286,"segment":13,"confidence":228.7152961661491,"asi":{"hypothesis":"Validate retained discovery/runtime ordering against the entire workspace and confirm the improved local-hit range after reverting speculative changes.","rollback_reason":"Verification only; 24.96 ms exceeds retained minimum 24.24 ms, so no additional implementation is kept.","evidence":"Full workspace tests and full workspace strict Clippy passed. Automatic checks now include live reporter unit tests as well as module, graph, sampler and formatting checks.","next_action_hint":"Continue with a fresh hypothesis grounded in 2.38 ms discovery-client initialization or 7 ms tracker waits; preserve proxy correctness and filesystem validation.","validation_state":"Retained event-runtime change has passed full workspace tests, workspace lint, reporter/signal integration tests and 25 event transport tests. ShellSpec passed before this runtime-ordering change and should be rerun before handoff."}}
{"run":53,"commit":"227c580","metric":25.02439468,"metrics":{"mean_ms":24.681743979999997,"stddev_ms":1.8997392646980122,"process_floor_ms":4.29889762},"status":"discard","description":"Filesystem barrier and discovery overlap on the invocation runtime did not improve local hits","timestamp":1791360004508,"segment":13,"confidence":102.2800462552989,"asi":{"hypothesis":"After reading the prior receipt, poll the filesystem barrier before independent discovery so IPC latency can overlap discovery setup without altering proxy or TLS behavior.","revisits_run":37,"changed_assumption":"Discovery now runs on the invocation runtime instead of a dedicated blocking runtime; the barrier is first in join order rather than hidden behind a receipt-read future.","rollback_reason":"Median 25.02 ms did not beat retained 24.24 ms. Cooperative overlap did not deliver an end-to-end benefit.","evidence":"Nine tracker tests, seven signal integration tests and all automatic strict checks passed. Both discovery and filesystem barriers remain mandatory.","next_action_hint":"Close generic preflight/barrier overlap for this fixture. Do not add yield-based scheduling tricks. Investigate a different source of work or strengthen generalizable performance diagnostics."}}
{"run":54,"commit":"227c580","metric":30.751331460000003,"metrics":{"mean_ms":30.753622209999993,"stddev_ms":2.09857148177593,"process_floor_ms":6.768226519999998},"status":"discard","description":"Measure async dispatch frame sizes before considering boxing or allocation changes","timestamp":1791360477554,"segment":13,"confidence":228.7152961661491,"asi":{"hypothesis":"A large async command-dispatch future could impose stack zeroing and heap-copy costs on all short-lived commands; measure its actual size before altering dispatch.","rollback_reason":"Diagnostic-only test is not an optimization, and 30.75 ms control is slower under renewed host load.","diagnostics":{"dispatch_future_bytes":704,"command_future_bytes":13376},"evidence":"Outer future is 704 bytes and boxed command future is only 13,376 bytes. These sizes do not justify a major routing/boxing redesign to target milliseconds of latency.","next_action_hint":"Do not pursue speculative future boxing. Host process floor increased from roughly 4 to 6.77 ms; wait for consistent phase evidence before retaining small changes."}}
{"run":55,"commit":"227c580","metric":28.853086220000005,"metrics":{"mean_ms":28.80389002,"stddev_ms":0.8514532324248214,"process_floor_ms":5.5004646600000004,"control_local_hit_ms":28.751052500000004},"status":"discard","description":"Fresh paired original-runtime control does not confirm a speedup from runtime deferral","timestamp":1791361028556,"segment":13,"confidence":217.5365475379424,"asi":{"hypothesis":"Compare freshly built validated original startup ordering (80c1709) with retained deferred-runtime ordering using identical fixture, cache state, five warmups and 40 measured commands.","rollback_reason":"No new implementation change. Treatment 28.85 ms is slightly slower than fresh control 28.75 ms; the apparent historical gain is not confirmed.","evidence":"Control mean 29.01 ms, standard deviation 1.95 ms; treatment mean 28.80 ms, standard deviation 0.85 ms. Current source checks and strict lint passed.","next_action_hint":"Run reverse-order paired measurements. If the variants remain indistinguishable, remove or narrow runtime-deferral complexity rather than claiming the earlier host-driven improvement.","control_commit":"80c1709","treatment_commit":"227c580","paired_delta_ms":0.102033720000001,"measurement_integrity":"Only executable source commit changes. Both variants use original run-once.sh, same manifests, normal receipt validation, release profile, cache directories and hyperfine sampling. No production benchmark shortcuts were introduced.","learning":"The strong 273.59-to-about-30 ms sampler cancellation gain is independent of this small runtime-ordering candidate. Do not conflate their confidence."}}
{"run":56,"commit":"227c580","metric":29.130206260000005,"metrics":{"mean_ms":29.27763921,"stddev_ms":1.7299657799395463,"process_floor_ms":6.17269518,"control_local_hit_ms":28.720139340000003},"status":"discard","description":"Reverse-order paired comparison again favors original runtime ordering slightly","timestamp":1791361388364,"segment":13,"confidence":222.43267082111282,"asi":{"hypothesis":"Reverse measurement order to check whether cache warmup or host drift produced the previous apparent lack of runtime-deferral benefit.","rollback_reason":"Verification only. Deferred runtime median 29.13 ms is above original 28.72 ms, with no convincing improvement in either A/B ordering.","evidence":"Control-first delta +0.10 ms and treatment-first delta +0.41 ms both favor the original ordering, though differences are within noise. Current checks and lint passed.","next_action_hint":"Remove the unproven runtime-deferral implementation and its performance-only blocked-worker regression test while retaining sampler shutdown cancellation and lint fix. Benchmark that simplification against a fresh retained control.","control_commit":"80c1709","treatment_commit":"227c580","paired_delta_ms":0.41006692000000156,"learning":"Earlier 26.27 and 24.24 ms readings reflected lower host startup cost, not a demonstrated runtime-ordering win. Session documentation must retract that claimed gain."}}
{"run":57,"commit":"6482654","metric":28.99010308,"metrics":{"mean_ms":29.315847155,"stddev_ms":1.4521893313105119,"process_floor_ms":5.64992602,"control_local_hit_ms":29.25187608},"status":"keep","description":"perf(cli): remove unproven event-runtime deferral after paired validation","timestamp":1791361952884,"segment":13,"confidence":215.9180861675634,"asi":{"hypothesis":"Remove runtime-deferral complexity because both A/B orderings failed to confirm its claimed gain; preserve the independently proven sampler cancellation optimization.","evidence":"Simplification measured 28.99 ms against fresh deferral control 29.25 ms. Earlier paired comparisons also slightly favored original ordering. Seven signal tests, 25 event transport tests and all automatic reporter/sampler/graph/module checks and strict lint passed.","paired_delta_ms":-0.26177299999999715,"control_commit":"227c580","primary_comparison":"Use the fresh same-host control, not the invalid 24.24 ms historical minimum obtained under lower startup load.","noise_note":"The 0.26 ms difference is within noise; the justified outcome is removal of extra code at no demonstrated performance cost, not a new substantive latency claim.","removed_test":"The single-blocking-worker test asserted only the removed performance strategy. Sampler shutdown, actual event transport and spawned signal cancellation regressions remain covered.","next_action_hint":"Do not reintroduce runtime deferral or count its earlier apparent gain. Continue paired measurements for small candidates and preserve the proven approximately 250 ms cancellation saving.","documentation":"Both persisted playbooks retract the initial runtime-deferral attribution and explain paired controls and host drift."}}
{"run":58,"commit":"6482654","metric":30.199991740000005,"metrics":{"mean_ms":31.095328990000006,"stddev_ms":2.6732351083569412,"process_floor_ms":6.539022440000003,"control_local_hit_ms":29.702788520000002,"graph_hit_ms":157.56478350000003},"status":"discard","description":"Measure full graph cache-hit fallback as a secondary guard against receipt-only overfitting","timestamp":1791362611878,"segment":13,"confidence":232.77627504101383,"asi":{"hypothesis":"Compare unchanged receipt hits with normal full-graph cache hits using the existing public ONCE_CHANGE_TRACKER=0 setting, without changing the primary workload.","rollback_reason":"Diagnostic only. Primary 30.20 ms is slightly worse than identical-code fresh control 29.70 ms, confirming about 0.5 ms paired noise.","evidence":"Full graph fallback median is 157.56 ms, mean 159.51 ms, standard deviation 4.77 ms. Primary fixture remains untouched and still uses the default tracker behavior.","next_action_hint":"Inspect full-graph fallback logs for large generalizable costs, while retaining receipt-hit latency as primary and graph_hit_ms as a regression monitor. Do not disable tracker in the primary benchmark.","measurement_integrity":"No manifests, action outputs, validation or cache semantics changed. The supplementary scenario uses a supported normal command environment setting for one-shot and tracker-unavailable workflows.","graph_hit_ms":157.56478350000003,"paired_identical_code_delta_ms":0.4972032200000025}}
{"run":59,"commit":"afa795b","metric":29.1145293,"metrics":{"mean_ms":28.878308149999995,"stddev_ms":1.5694906019087778,"process_floor_ms":5.855124339999999,"control_local_hit_ms":29.67853922,"graph_hit_ms":155.92481168},"status":"keep","description":"perf(cli): overlap filesystem barrier with discovery on the dedicated event runtime","timestamp":1791363619857,"segment":13,"confidence":222.95704748737307,"asi":{"hypothesis":"With discovery restored to its dedicated runtime, poll the filesystem barrier first so HTTP client construction can run independently after the receipt read warms the blocking pool.","revisits_run":53,"changed_assumption":"Runtime deferral was removed after paired validation. Unlike run 53, client construction is off the invocation thread, so it can overlap IPC work.","evidence":"Primary 29.11 ms versus matched control 29.68 ms. Full graph fallback remained healthy at 155.92 ms. Nine tracker tests, seven signal integration tests, reporter/sampler/graph/module checks and strict lint passed.","paired_delta_ms":-0.5640099200000002,"control_commit":"6482654","noise_note":"Gain is approximately the 0.5 ms identical-code paired noise seen in run 58. Treat this keep as provisional until reverse-order confirmation.","diagnostics":{"preflight_ms":4.383087158203125,"receipt_ms":6.893157958984375,"session_ms":11.653900146484375},"next_action_hint":"Verify overlap in reverse order. Consider whether sampler CPU initialization now blocks barrier startup on the invocation thread, a different critical path than earlier standalone sampling attempts."}}
{"run":60,"commit":"f06afb0","metric":29.248219040000002,"metrics":{"mean_ms":29.207877390000014,"stddev_ms":0.9810881842251649,"process_floor_ms":6.279093500000001,"control_local_hit_ms":29.48022858,"graph_hit_ms":163.9839035},"status":"keep","description":"Verify barrier/discovery overlap against a fresh reverse-order control","timestamp":1791364000919,"segment":13,"confidence":215.48072672290064,"asi":{"hypothesis":"Reverse comparison order to confirm the direction of the small preflight/barrier overlap gain without source changes.","evidence":"Overlap again favored: 29.25 ms versus 29.48 ms matched original control. First comparison favored overlap by 0.56 ms; reverse comparison by 0.23 ms. All automatic checks passed.","paired_delta_ms":-0.2320095399999964,"control_commit":"6482654","noise_note":"Both measurements favor overlap but magnitude is below the identical-code noise floor. No strong sub-millisecond speedup claim is justified.","next_action_hint":"Test connected-only sampling as a composition with parallel barrier startup, because sampler CPU setup may be delaying IPC on the invocation runtime. Compare against overlap-only commit afa795b.","secondary_note":"Full-graph fallback rose to 163.98 ms after a longer multi-build run. There is no source change in this verification; monitor host load and schema-loading cost instead of attributing it to overlap."}}
