{"asi": {"evidence": "The no-module path is proven borrowed by a focused test. The custom-module 40-run repeat measured 22.61 milliseconds versus 22.51 milliseconds immediately before this treatment, effectively flat under current host noise. Module tests, strict linting, and formatting passed.", "hypothesis": "Clone-on-write module composition can remove the temporary built-in source copy when no custom modules exist, while exact capacity avoids repeated growth when files are appended.", "next": "Run complete workspace validation, update the benchmark report with resident-memory and traversal results, and ask Claude to challenge the retained design."}, "commit": "e7ca5b5", "confidence": 4.176707370842155, "description": "perf(frontend): borrow unchanged module source", "metric": 22.61238012, "metrics": {"branches": 5000.0, "mean_ms": 23.27653412, "small_fixture_repeat_ms": 22.50535072, "stddev_ms": 3.46453693, "unpruned_large_workspace_median_ms": 127.61449872}, "run": 25, "segment": 11, "status": "keep", "timestamp": 1785089963290}
{"bestDirection": "lower", "maxIterations": 2, "metricName": "local_hit_ms", "metricUnit": "ms", "name": "Pre-size analysis module source", "timestamp": 1785090329432, "type": "config"}
{"asi": {"evidence": "Two 40-run treatments measured 20.69 and 19.05 milliseconds median versus the preceding 22.61-millisecond repeat. The stable treatment is 15.7 percent lower. The source now reserves the exact selected prelude size, borrows index path strings, and reuses the first output metadata lookup. Focused tests, strict linting, formatting, full workspace tests, and 241 command-line specifications passed.", "hypothesis": "The graph-build path knows all selected prelude lengths in advance and can avoid repeated String growth plus cloned static path names.", "next": "Retain bounded portable I/O. Design remote stream-to-cache as a separate change before replacing capture buffering, because generic put_stream intentionally limits very large remote uploads today."}, "commit": "5e5c8b6", "confidence": null, "description": "perf(frontend): pre-size selected module source", "metric": 19.05348426, "metrics": {"first_treatment_median_ms": 20.6908135, "mean_ms": 19.448197635, "preceding_repeat_median_ms": 22.61238012, "stddev_ms": 1.880332101}, "run": 26, "segment": 12, "status": "keep", "timestamp": 1785090463515}
{"type":"config","name":"Reduce Once local-hit latency, resumed current worktree","metricName":"local_hit_ms","metricUnit":"ms","bestDirection":"lower"}
{"run":27,"commit":"0682c3e","metric":273.5881697,"metrics":{"mean_ms":273.85500787500007,"stddev_ms":1.7753811748563468},"status":"keep","description":"Establish fresh baseline on current worktree","timestamp":1791347212440,"segment":13,"confidence":null,"asi":{"hypothesis":"Fresh release measurements provide a valid control after repository changes since the previous research session.","evidence":"Current local-hit median is 273.59 ms versus historical 19 ms; focused checks pass.","next_action_hint":"Investigate process wrapper and new graph execution behavior before small allocation experiments."}}
{"run":28,"commit":"9131a7e","metric":29.620474020000003,"metrics":{"mean_ms":30.04116052,"stddev_ms":3.9269798409293353},"status":"keep","description":"fix(cli): interrupt initial system sampling wait on shutdown","timestamp":1791347413640,"segment":13,"confidence":null,"asi":{"hypothesis":"Allow shutdown to interrupt the initial CPU sampling delay instead of waiting 250 ms before checking its channel.","evidence":"Median improved 89.2 percent from 273.59 to 29.62 ms. Tests prove shutdown before first sample and continued sampling for longer runs.","next_action_hint":"Verify the gain and profile remaining sampler setup, event preflight, and fast-path filesystem work.","scope_note":"System sampler fix is in CLI event production adjacent to graph dispatch; preserves sampling and reporting semantics."}}
{"run":29,"commit":"9131a7e","metric":30.193575360000004,"metrics":{"mean_ms":30.38325908499999,"stddev_ms":3.1322423108014883},"status":"discard","description":"Starting system sampling only for connected event services did not improve local-hit median","timestamp":1791347629973,"segment":13,"confidence":425.6973045639704,"asi":{"hypothesis":"Avoid CPU, memory, and network sampler initialization when event preflight finds no service.","rollback_reason":"Median 30.19 ms is worse than the retained 29.62 ms despite reduced work; do not retain unproven performance changes.","next_action_hint":"Read session log timings and profile configuration, filesystem watcher, and live preflight startup to identify a stronger candidate.","evidence":"All seven reporter unit tests and seven spawned cancellation integration tests passed; eliminating inactive sampler initialization was not measurable above noise."}}
{"run":30,"commit":"9131a7e","metric":31.089838720000003,"metrics":{"mean_ms":31.321181144999994,"stddev_ms":1.7653100557225994},"status":"discard","description":"Partial source-digest cache deserialization did not improve the 15-target local-hit workload","timestamp":1791347908444,"segment":13,"confidence":332.0723516496619,"asi":{"hypothesis":"Deserialize only cache schema and watcher position instead of allocating every cached source and output entry before receipt validation.","rollback_reason":"Median regressed from 29.62 to 31.09 ms; small 12 KiB source digest file does not make avoided allocations material.","next_action_hint":"Investigate stronger repeated configuration or preflight work, and obtain a reverted control measurement.","evidence":"Eleven source-digest tests passed, including round-trip position and corrupted cache tests; legacy checks separately passed.","checks_note":"Creating .auto for ideas switched the harness away from legacy checks discovery. Install a .auto/checks.sh wrapper before next run."}}
{"run":31,"commit":"9131a7e","metric":30.784977660000003,"metrics":{"mean_ms":31.087884810000002,"stddev_ms":2.2045657066856923},"status":"discard","description":"Overlapping build receipt read with reporting preflight did not beat retained latency","timestamp":1791348209404,"segment":13,"confidence":412.52409008216665,"asi":{"hypothesis":"Read persisted build receipt concurrently with independent reporting preflight using tokio::join while preserving subscription before events.","rollback_reason":"Median 30.78 ms exceeds retained 29.62 ms. Local receipt read is too small to make overlap a meaningful win.","next_action_hint":"Run reverted control to assess host drift, then reduce repeated configuration parsing instead of hiding small filesystem reads.","evidence":"Receipt and seven cancellation tests passed; automatic focused module, graph, sampler, formatting checks passed.","session_layout":"Full legacy log migrated into .auto/log.jsonl and .auto/checks.sh now explicitly invokes legacy focused checks plus sampler regressions."}}
{"run":32,"commit":"9131a7e","metric":52.55896658000001,"metrics":{"mean_ms":54.17806660500002,"stddev_ms":14.165404705883693},"status":"discard","description":"Unchanged control repeat shows substantial host noise","timestamp":1791348438389,"segment":13,"confidence":236.7736824978274,"asi":{"hypothesis":"A reverted control repeat distinguishes host drift from small speculative optimization regressions.","rollback_reason":"No code changes; unchanged control was slower than retained 29.62 ms and had 14.17 ms standard deviation.","next_action_hint":"Avoid drawing conclusions from sub-millisecond deltas while host load is unstable. Prefer structural reductions and paired repeated measurements.","evidence":"Same retained code measured 52.56 ms median compared with 29.62 ms earlier; correctness checks remain passing."}}
{"run":33,"commit":"9131a7e","metric":43.89178336,"metrics":{"mean_ms":48.11012401,"stddev_ms":17.636925095951792},"status":"discard","description":"Resolving live-reporting configuration once reduced work but did not beat established best under load","timestamp":1791348873878,"segment":13,"confidence":166.03617582483096,"asi":{"hypothesis":"Resolve one invocation-owned provider configuration for reporting scope, discovery, authentication, and token renewal, removing redundant manifest parses.","rollback_reason":"43.89 ms median did not beat retained 29.62 ms. Host noise is substantial, so an apparent gain versus 52.56 ms recent control is insufficient proof.","next_action_hint":"Consider a paired quiet-system retry only after load stabilizes; use the same credentials/provider snapshot for reporting scope and renewal.","evidence":"Removed 52 net lines and three redundant config resolutions. Six live reporter, 23 provider, seven cancellation tests and all automatic checks passed.","discarded_design":"spawn takes only bus/workspace/xdg, resolves config in reporter runtime, derives account/project from it, passes it to discovery and read_token, and clones it for renewal."}}
{"run":34,"commit":"9131a7e","metric":29.85136742,"metrics":{"mean_ms":29.881937195000006,"stddev_ms":1.3810034715628496,"process_floor_ms":6.050991160000001},"status":"discard","description":"Stable control confirms retained sampler improvement and 6 ms process floor","timestamp":1791349079187,"segment":13,"confidence":203.05471490268607,"asi":{"hypothesis":"Compare command startup floor with local-hit timing to separate binary/runtime cost from graph/reporting overhead under calmer host load.","rollback_reason":"No implementation change; 29.85 ms is essentially the retained 29.62 ms with 1.38 ms standard deviation.","next_action_hint":"Approximately 24 ms remain beyond version-only floor; inspect initial sampler and tracker work rather than persistent daemon or wholesale compiler changes.","evidence":"Host load has stabilized enough to reproduce retained improvement. Process-only median is 6.05 ms."}}
{"run":35,"commit":"9131a7e","metric":29.743259020000004,"metrics":{"mean_ms":29.696414445000013,"stddev_ms":2.10976218139275,"process_floor_ms":7.172232980000001},"status":"discard","description":"Retry connected-only sampling after stable control still does not beat retained median","timestamp":1791349310141,"segment":13,"confidence":234.19730271889938,"asi":{"hypothesis":"Recheck avoiding unobserved host sampling now that host CPU load stabilized and unchanged control returned to 29.85 ms.","revisits_run":29,"rollback_reason":"29.74 ms still exceeds retained 29.62 ms; two independent attempts show at most noise-level benefit.","next_action_hint":"Do not repeat connected-only sampling without a materially different workload. Focus on measured tracker/preflight costs or compile-time startup behavior.","evidence":"Primary only 0.11 ms below immediate control; version floor drifted 1.12 ms. Seven reporter and seven signal integration tests passed."}}
{"run":36,"commit":"9131a7e","metric":31.095760220000003,"metrics":{"mean_ms":34.36878507,"stddev_ms":9.680459302324346,"process_floor_ms":4.60225744},"status":"discard","description":"Full release LTO improved process floor but not local-hit primary metric","timestamp":1791349759038,"segment":13,"confidence":213.98892381746023,"asi":{"hypothesis":"Whole-program release optimization can reduce binary initialization and cross-crate instruction overhead on short-lived CLI runs.","rollback_reason":"Local-hit median 31.10 ms is above retained 29.62 ms even though version-only process floor improved to 4.60 ms; build took 396 seconds.","next_action_hint":"Retain thin LTO. Focus on the roughly 25 ms wrapper/reporting/tracker remainder rather than optimizer settings.","evidence":"Full LTO reduces startup floor relative to 6.05-7.17 ms controls but end-to-end gains do not carry through; all focused checks passed."}}
{"run":37,"commit":"9131a7e","metric":34.48198382,"metrics":{"mean_ms":36.34146769499999,"stddev_ms":7.60091102109966,"process_floor_ms":7.17996724},"status":"discard","description":"Overlap the whole receipt and tracker snapshot with event preflight instead of just receipt I/O","timestamp":1791350058643,"segment":13,"confidence":181.17583064708316,"asi":{"hypothesis":"The filesystem tracker barrier is the real asynchronous wait; hiding it behind independent event preflight should save more than merely overlapping a small receipt read.","revisits_run":31,"rollback_reason":"Median 34.48 ms remains above retained 29.62 ms; wider concurrency did not produce a clear end-to-end gain.","next_action_hint":"Keep original sequencing. Inspect tracing initialization and small default filter overhead, or collect more phase diagnostics before another concurrency change.","evidence":"Nine tracker tests and seven spawned cancellation tests passed. Process floor 7.18 ms indicates several ms host/runtime drift remains; no correctness failures."}}
{"run":38,"commit":"9131a7e","metric":30.024560560000005,"metrics":{"mean_ms":30.72805683499999,"stddev_ms":3.01778241126397,"process_floor_ms":7.08660696},"status":"discard","description":"Simple target filters for default logging did not improve end-to-end local-hit latency","timestamp":1791350319957,"segment":13,"confidence":213.98892381746023,"asi":{"hypothesis":"Use Targets instead of dynamic EnvFilter for built-in level-only directives, preserving EnvFilter for user-supplied overrides.","rollback_reason":"30.02 ms exceeds retained 29.62 ms; avoided default directive parsing and dynamic span filter state are too small for this workload and add layer boxing.","next_action_hint":"Keep existing logging. Consider one buffered writer with explicit shutdown flush if tracing writes emerge in profiling; do not suppress session logs.","evidence":"Eleven logging tests passed including target-prefix/default-level preservation. Dynamic ONCE_LOG/RUST_LOG semantics preserved by original EnvFilter branches."}}
{"run":39,"commit":"9131a7e","metric":0,"metrics":{"mean_ms":0,"stddev_ms":0,"process_floor_ms":0},"status":"crash","description":"HTTP discovery TLS root setup experiment used an unavailable reqwest builder API","timestamp":1791350423952,"segment":13,"confidence":213.98892381746023,"asi":{"hypothesis":"Avoid loading TLS certificate roots for HTTP discovery requests with redirects forbidden.","rollback_reason":"Compiler E0599: reqwest::ClientBuilder has no tls_built_in_root_certs method in the pinned version.","next_action_hint":"Read pinned reqwest features and builder API before retrying; this may not be a TLS initialization bottleneck at all.","error":"method not found at discovery.rs:16","discarded_tests":"Added real HTTP tests for discovery JSON, missing document, redirect prohibition, and 64 KiB document bound."}}
{"run":40,"commit":"9131a7e","metric":30.812161520000004,"metrics":{"mean_ms":31.73687664500001,"stddev_ms":2.847558085606051,"process_floor_ms":6.161971},"status":"discard","description":"Full workspace tests pass for retained sampler fix; control median remains about 30 ms","timestamp":1791350940149,"segment":13,"confidence":253.92297442292661,"asi":{"hypothesis":"Validate retained sampler shutdown fix against the entire workspace before further changes and confirm current local-hit timing.","rollback_reason":"No implementation change; 30.81 ms does not beat retained 29.62 ms.","next_action_hint":"Continue optimization with a stable control and preserve HTTPS proxy trust in any discovery changes. Run clippy and ShellSpec during subsequent validation.","evidence":"mise exec -- cargo test --workspace --quiet passed. Focused automatic checks also passed. TLS-root bypass deferred due HTTPS proxy correctness risk."}}
{"run":41,"commit":"9131a7e","metric":31.145573340000002,"metrics":{"mean_ms":31.670295214999992,"stddev_ms":2.597683609615559,"process_floor_ms":6.599868579999998},"status":"discard","description":"Quiet-system retry of single live-reporting configuration snapshot remains slower","timestamp":1791351225626,"segment":13,"confidence":240.8282275973707,"asi":{"hypothesis":"Retry eliminating repeated infrastructure resolution with calmer host load after unchanged control measured 30.81 ms and 2.85 ms standard deviation.","revisits_run":33,"rollback_reason":"31.15 ms did not improve either immediate 30.81 ms control or retained 29.62 ms best. Stable repeat confirms too little benefit.","next_action_hint":"Stop retrying config deduplication on this fixture. Profile the wrapper and actual CLI phases before more hot-path changes.","evidence":"6 reporter tests, 23 provider tests, 7 cancellation integration tests, and automatic focused checks passed. Token renewal preserves the invocation provider while re-reading credentials."}}
{"run":42,"commit":"9131a7e","metric":31.008546860000003,"metrics":{"mean_ms":32.400971760000004,"stddev_ms":4.762807008731521,"process_floor_ms":6.434222200000001},"status":"discard","description":"Phase diagnostics identify fixed wrapper cost and receipt/tracker wait as remaining latency","timestamp":1791351442509,"segment":13,"confidence":247.93810206503937,"asi":{"hypothesis":"Measure counterbalanced direct and wrapper invocations plus existing session timestamps to identify remaining controllable latency without changing benchmark semantics.","rollback_reason":"No implementation changes; control 31.01 ms remains above retained best 29.62 ms.","next_action_hint":"Do not optimize benchmark wrapper. Investigate receipt/tracker 7.75 ms and 12 ms outside session. Avoid repeated source/allocation ideas now known to be outside this hot path.","diagnostics":{"direct_median_ms":24.449562000000036,"wrapper_median_ms":31.771000000000022,"wrapper_overhead_ms":7.321437999999986,"preflight_ms":4.199981689453125,"receipt_ms":7.745027542114258,"session_ms":12.395143508911133,"phase_samples":23},"evidence":"Wrapper-only overhead is roughly 7.32 ms. Session log spans 12.40 ms, suggesting normal CLI argument processing before logging and process startup comprise another roughly 12 ms."}}
{"run":43,"commit":"9131a7e","metric":0,"metrics":{"mean_ms":53.36311859500002,"stddev_ms":23.6713905055909,"process_floor_ms":4.671712780000001},"status":"crash","description":"Startup profiling completed but diagnostic parser rejected tracing string-encoded u128 fields","timestamp":1791351707832,"segment":13,"confidence":247.93810206503937,"asi":{"hypothesis":"Time argument parsing and logging initialization before the session start event to locate the unaccounted startup cost.","rollback_reason":"Diagnostic script divided tracing u128 string values by an integer, raising TypeError after the benchmark passed; profiling-only source changes will be reverted.","next_action_hint":"Convert numeric trace fields with float(). Source inspection of one captured run disproves expensive argument parsing or logging setup: 0.037 ms parse, 0.286 ms logging.","error":"TypeError: unsupported operand type(s) for /: 'str' and 'int'","captured_startup":{"parse_ms":0.037,"logging_ms":0.286},"benchmark_before_diagnostic_failure_ms":47.38719272,"evidence":"Session lasted roughly 8.86 ms in inspected run; host load distorted primary benchmark to 47.39 ms with 23.67 ms standard deviation."}}
{"run":44,"commit":"9131a7e","metric":0,"metrics":{"mean_ms":0,"stddev_ms":0,"process_floor_ms":0},"status":"crash","description":"Full strict clippy found ignored-unit-pattern lint in retained sampler cancellation branch","timestamp":1791351839735,"segment":13,"confidence":247.93810206503937,"asi":{"hypothesis":"Run strict workspace linting and CLI contract validation after full workspace tests passed.","rollback_reason":"No new source changes. Clippy -D warnings rejected `_ = tokio::time::sleep(...)`; use `() =` for unit-valued sleep future.","next_action_hint":"Correct the sampler select unit pattern and extend focused backpressure to include strict CLI clippy so later keeps cannot introduce this lint.","error":"clippy::ignored_unit_patterns at bus_events.rs:43","evidence":"Full workspace tests passed in run 40, but focused checks lacked strict clippy. ShellSpec and fresh measurement were not reached."}}
{"run":45,"commit":"80c1709","metric":30.05535388,"metrics":{"mean_ms":30.019179505,"stddev_ms":1.1041586281634204,"process_floor_ms":7.1464554599999985},"status":"keep","description":"fix(cli): satisfy strict lint for cancellable sampler startup","timestamp":1791352668709,"segment":13,"confidence":280.2947437650197,"asi":{"hypothesis":"Finalize the retained cancellation optimization with the correct unit-valued select pattern and strict lint backpressure.","evidence":"All workspace clippy targets and ShellSpec passed. Stable 40-run local-hit median is 30.06 ms, below latest unchanged control of 31.01 ms and 89 percent below resumed 273.59 ms baseline.","correctness_fix":"Use () instead of _ to match the sleep future; this is behaviorally identical, not a claimed additional speedup.","control_reference":{"run":42,"local_hit_ms":31.008546860000003},"noise_note":"Difference versus 29.62 ms historical minimum is within run-to-run noise. The retained sampler cancellation gain is the substantive improvement, and this completes its validation.","next_action_hint":"Keep strict CLI clippy in .auto/checks.sh. Continue with new structurally justified candidates; do not revisit small discarded ideas without new profiling evidence."}}
