{"bestDirection": "higher", "maxIterations": 4, "metricName": "detection_f1_pct", "metricUnit": "pct", "name": "Validate scripted action filesystem contracts", "timestamp": 1784457837912, "type": "config"}
{"asi": {"evidence": "The existing input sandbox reports only the relative missing read. Seven successful contract violations are silent.", "hypothesis": "A post-run execution-root inventory and input snapshot will improve recall without requiring ecosystem-specific execution branches.", "next": "Add a generic validation report that snapshots inputs, inventories writes, and exposes explicit read-observation limitations."}, "commit": "3363b6b", "confidence": null, "description": "test(autoresearch): establish filesystem contract baseline", "metric": 22.22, "metrics": {"actionable_diagnostic_rate_pct": 0.0, "benchmark_ms": 1011.11, "false_positive_rate_pct": 0.0, "precision_pct": 100.0, "recall_pct": 12.5, "runtime_overhead_pct": 4.97}, "run": 1, "segment": 0, "status": "keep", "timestamp": 1784457897015}
{"asi": {"evidence": "The eight adversarial cases report with path-specific repairs and the four open-source-inspired controls remain clean.", "hypothesis": "A validation-only sandbox plus filesystem inventory covers successful writes and literal workspace escapes while preserving the current isolation shape.", "next": "Add correctness tests and generated references; retain the documented successful-read limitation."}, "commit": "cb31652", "confidence": null, "description": "Post-run private-root inventory, workspace snapshot, symlink checks, and path-specific preflight repairs", "metric": 100.0, "metrics": {"actionable_diagnostic_rate_pct": 100.0, "benchmark_ms": 830.46, "false_positive_rate_pct": 0.0, "precision_pct": 100.0, "recall_pct": 100.0, "runtime_overhead_pct": -24.64}, "run": 2, "segment": 0, "status": "keep", "timestamp": 1784459003271}
{"bestDirection": "lower", "metricName": "local_hit_ms", "metricUnit": "ms", "name": "Reduce Once local-hit latency", "timestamp": 1785067159152, "type": "config"}
{"asi": {"evidence": "Forty warmed local-hit runs measured 26.30 ms median with 1.00 ms standard deviation after the full workspace and 241 command-line examples passed.", "hypothesis": "A committed validated baseline makes allocator, logging, thread, and remote-fetch experiments safely reversible.", "next": "Test mimalloc, then profile remaining logging and remote round trips."}, "commit": "887287e", "confidence": null, "description": "perf(cache): establish optimized cache-hit baseline", "metric": 26.30178784, "metrics": {"mean_ms": 26.397057340000003, "stddev_ms": 1.001693696791129}, "run": 3, "segment": 1, "status": "keep", "timestamp": 1785067371465}
{"asi": {"evidence": "Mimalloc measured 25.75 ms in its stable repeat, while the immediately rebuilt system allocator measured 25.13 ms. A separate allocator run was badly distorted by system load.", "hypothesis": "Page-local allocator sharding helps concurrent workloads, but Once now keeps this fast path mostly on one thread and does not recover the added allocator startup cost.", "next": "Keep the system allocator and target repeated logging setup, parsing, and remote request dependencies instead."}, "commit": "887287e", "confidence": null, "description": "Mimalloc did not beat the system allocator above noise", "metric": 25.74753904, "metrics": {"mean_ms": 25.694398565, "stddev_ms": 0.7672663297082527}, "run": 4, "segment": 1, "status": "discard", "timestamp": 1785067729053}
{"bestDirection": "lower", "metricName": "remote_hit_ms", "metricUnit": "ms", "name": "Reduce Once clean-client remote-hit latency", "timestamp": 1785067817353, "type": "config"}
{"asi": {"evidence": "Twenty clean-client remote hits measured 176.89 ms median and 175.53 ms mean with a 6.02 ms standard deviation.", "hypothesis": "Per-request blocking authentication and duplicate initial channel connections add avoidable remote-path latency.", "next": "Resolve authentication once per process and make channel initialization single-flight."}, "commit": "35cb3a6", "confidence": null, "description": "bench(cache): establish clean-client remote baseline", "metric": 176.89370064000002, "metrics": {"mean_ms": 175.52900279000002, "stddev_ms": 6.0185823858424135}, "run": 5, "segment": 2, "status": "keep", "timestamp": 1785067917625}
{"asi": {"evidence": "After an outlier run under system load, the stable repeat measured 173.55 ms median versus the 176.89 ms baseline. Two earlier repeats of the same fast path measured 174.85 and 175.03 ms.", "hypothesis": "Resolving authentication once, making channel establishment single-flight, and avoiding a throwaway single-endpoint probe removes blocking-pool handoffs and duplicate transport setup.", "next": "Move validated host tool identity caching out of disposable workspace action state, then optimize prelude selection."}, "commit": "a88a311", "confidence": null, "description": "perf(cache): reuse remote session initialization", "metric": 173.54889292000004, "metrics": {"mean_ms": 174.74257862000005, "stddev_ms": 6.605583595898492}, "run": 6, "segment": 2, "status": "keep", "timestamp": 1785068343320}
{"asi": {"evidence": "Two controlled remote runs measured 143.42 and 148.71 ms median versus the 176.89 ms baseline. The stable repeat improved median latency by 15.9 percent.", "hypothesis": "Host executable paths and safe version probes are machine identity, not disposable action state. Retaining them avoids toolchain-manager and Node process startup after an action-cache clear.", "next": "Replace the full prelude source scan with indexed target-kind metadata and return to local-hit measurement."}, "commit": "3bd9f3d", "confidence": 8.425649513868077, "description": "perf(toolchain): retain validated host identity across cache clears", "metric": 148.71152310000002, "metrics": {"mean_ms": 148.98720445000004, "stddev_ms": 6.170532407576242}, "run": 7, "segment": 2, "status": "keep", "timestamp": 1785068593592}
{"bestDirection": "lower", "metricName": "local_hit_ms", "metricUnit": "ms", "name": "Eliminate prelude selection scans", "timestamp": 1785068677488, "type": "config"}
{"asi": {"evidence": "The indexed selector measured 23.95 ms median over 40 local hits versus the preceding system-allocator result of 25.13 ms. Focused tests and strict frontend lint pass.", "hypothesis": "Reading target-kind ownership from the small prelude index avoids scanning 838 KB of unused Starlark source before selective compilation.", "next": "Measure evidence-store synchronization and remaining per-target blocking-pool handoffs."}, "commit": "17efcdb", "confidence": null, "description": "perf(frontend): index built-in target kind modules", "metric": 23.94985434, "metrics": {"mean_ms": 23.974115615, "stddev_ms": 0.6014986423255764}, "run": 8, "segment": 3, "status": "keep", "timestamp": 1785068811511}
{"asi": {"evidence": "The shortcut measured 24.37 ms median, while the immediate reverted baseline measured 23.53 ms with 0.85 ms standard deviation. The shortcut adds compatibility state without a measurable win.", "hypothesis": "Replacing migration-table inspection with one SQLite schema-version query would reduce evidence-store setup.", "next": "Keep the migration source of truth unchanged and overlap evidence setup instead of changing its query protocol."}, "commit": "17efcdb", "confidence": null, "description": "Schema-version shortcut did not improve warmed evidence writes", "metric": 24.37245786, "metrics": {"mean_ms": 26.462243935, "stddev_ms": 7.197525233}, "run": 9, "segment": 3, "status": "discard", "timestamp": 1785069992143}
{"bestDirection": "lower", "maxIterations": 6, "metricName": "remote_hit_ms", "metricUnit": "ms", "name": "Reduce remote fetch copies", "timestamp": 1785070058759, "type": "config"}
{"asi": {"evidence": "The stable 20-run median fell from 148.71 ms to 41.57 ms, a 72.0 percent reduction. Seventy-six content-store tests and strict linting passed. Incompressible local writes also borrow their source bytes, and streamed remote reads reserve bounded capacity.", "hypothesis": "Remote action results are recoverable cache mirrors, so atomic visibility is sufficient and file plus directory durability synchronization is unnecessary on every clean-client hit.", "next": "Overlap evidence database initialization with graph execution, then rerun the full cross-client benchmark."}, "commit": "e4450c2", "confidence": null, "description": "perf(cache): avoid durable synchronization for remote mirrors", "metric": 41.56841732, "metrics": {"mean_ms": 43.23492387, "stddev_ms": 6.260940225}, "run": 10, "segment": 4, "status": "keep", "timestamp": 1785070845567}
{"bestDirection": "lower", "maxIterations": 5, "metricName": "local_hit_ms", "metricUnit": "ms", "name": "Overlap evidence initialization", "timestamp": 1785070860119, "type": "config"}
{"asi": {"evidence": "Trace timestamps confirmed setup completed before graph execution and reduced the post-build tail to about 1.7 ms, but the 40-run median was 23.80 ms versus the immediate 23.53 ms control. Early SQLite worker creation delayed the frontend enough to erase the overlap.", "hypothesis": "Starting the evidence connection alongside graph loading would hide database setup behind analysis and cache lookup.", "next": "Keep evidence sequencing simple and target benchmark wrapper cost or action lookup dependencies instead."}, "commit": "e4450c2", "confidence": null, "description": "Evidence initialization overlap moved rather than removed worker cost", "metric": 23.79910432, "metrics": {"mean_ms": 24.24458652, "stddev_ms": 1.779414756}, "run": 11, "segment": 5, "status": "discard", "timestamp": 1785071130982}
{"bestDirection": "lower", "maxIterations": 3, "metricName": "local_hit_ms", "metricUnit": "ms", "name": "Defer remote client initialization", "timestamp": 1785082893536, "type": "config"}
{"asi": {"evidence": "A 60-run comparison measured the process version floor at 4.35 ms median and the local hit at 21.77 ms median, leaving about 17 ms of actionable work.", "hypothesis": "Eager remote client construction contributes to every local hit even when no remote request is made.", "next": "Wrap remote client construction in a single-flight lazy cell and repeat the 40-run local benchmark."}, "commit": "0b0d39c", "confidence": null, "description": "Baseline before lazy remote client", "metric": 22.02476076, "metrics": {"mean_ms": 21.95988576, "stddev_ms": 0.9820898569866203}, "run": 12, "segment": 6, "status": "keep", "timestamp": 1785082907543}
{"asi": {"evidence": "Two 40-run repeats measured 18.89 ms and 18.37 ms median versus the 22.02 ms baseline, improving the stable repeat by 16.6 percent. Focused tests and formatting checks passed.", "hypothesis": "A local action-cache hit should not construct the unused remote Hypertext Transfer Protocol client and transport security state.", "next": "Re-measure clean-client remote hits to confirm moving initialization does not regress the remote path, then profile duplicate manifest and module parsing."}, "commit": "60aca8e", "confidence": null, "description": "perf(cache): defer remote client initialization", "metric": 18.369123860000002, "metrics": {"mean_ms": 18.46780841, "stddev_ms": 0.622034186500205}, "run": 13, "segment": 6, "status": "keep", "timestamp": 1785083044994}
{"asi": {"evidence": "The 40-run median regressed to 19.65 ms versus the 18.37 ms lazy-client baseline. The reversible setting does not justify a weaker crash-loss window.", "hypothesis": "Reducing reconstructible workspace-database synchronization from FULL to NORMAL might remove commit tail latency without changing journal format.", "next": "Retain full synchronization and avoid persistent write-ahead logging until a dedicated filesystem-compatibility design can justify it. Profile duplicate manifest reads or filesystem task handoffs next."}, "commit": "60aca8e", "confidence": 2.8434176595673257, "description": "Reduced database synchronization did not improve local hits", "metric": 19.654772799999996, "metrics": {"mean_ms": 19.6254152, "stddev_ms": 0.6683319529095072}, "run": 14, "segment": 6, "status": "discard", "timestamp": 1785083433196}
{"bestDirection": "lower", "maxIterations": 3, "metricName": "remote_hit_ms", "metricUnit": "ms", "name": "Reduce remote blob mirror durability barriers", "timestamp": 1785083784102, "type": "config"}
{"asi": {"evidence": "The preceding 20-run clean-client benchmark measured 38.78 ms median after lazy remote-client initialization.", "hypothesis": "A synchronized remote blob mirror pays one unnecessary parent-directory durability barrier on every clean-client output restoration.", "next": "Restore the treatment that synchronizes blob contents but not the recoverable directory entry, then repeat with 30 clean-client runs."}, "commit": "124ca64", "confidence": null, "description": "Baseline before recoverable remote blob mirrors", "metric": 39.9856555, "metrics": {"mean_ms": 41.47210456666668, "stddev_ms": 6.319998220067927}, "run": 15, "segment": 7, "status": "keep", "timestamp": 1785083885179}
{"asi": {"evidence": "Two 30-run clean-client treatments measured 37.77 ms and 36.27 ms median versus the 39.99 ms control, a stable-repeat reduction of 9.3 percent. The path now rejects digest mismatches before writing, and focused content-store tests passed.", "hypothesis": "Remote blob contents need synchronization before atomic rename, but their recoverable directory entry does not need a parent-directory durability barrier.", "next": "Keep locally produced blobs fully durable. Update the cross-client report after full validation, then investigate manifest-read deduplication separately because it affects a narrower workspace shape."}, "commit": "28bf066", "confidence": null, "description": "perf(cache): retain durable contents for remote blob mirrors", "metric": 36.267078160000004, "metrics": {"mean_ms": 37.926707459999996, "stddev_ms": 6.377191296502085}, "run": 16, "segment": 7, "status": "keep", "timestamp": 1785084013586}
{"bestDirection": "lower", "maxIterations": 4, "metricName": "local_hit_ms", "metricUnit": "ms", "name": "Stream cached output validation", "timestamp": 1785087919470, "type": "config"}
{"asi": {"evidence": "Five warmed local runs measured 23.10 to 23.54 MB maximum resident memory, while five version-only runs measured about 10.16 to 10.21 MB. The requested output is 1 MiB.", "hypothesis": "Validating one requested file currently holds its raw bytes and encoded file-blob bytes simultaneously, adding about 2.1 MB of peak live memory and one full-file copy.", "next": "Hash the file-blob prefix and file reader incrementally, prove digest identity against the existing encoded bytes, then repeat latency and resident-memory measurements."}, "commit": "e4415cb", "confidence": null, "description": "Baseline before streaming file-blob validation", "metric": 27.881501699999998, "metrics": {"mean_ms": 28.931616299999998, "stddev_ms": 4.894534346502892}, "run": 17, "segment": 8, "status": "keep", "timestamp": 1785087925679}
{"asi": {"evidence": "The preceding baseline was 27.88 ms versus the established 18 to 20 ms range.", "hypothesis": "The first segment baseline was inflated by transient host load and should not be used to judge a sub-millisecond content-hashing change.", "next": "Use this immediate repeat as the latency control and preserve the separately sampled 23.1 to 23.5 MB resident-memory range."}, "commit": "64d29a4", "confidence": null, "description": "Stable baseline before streaming file-blob validation", "metric": 22.52428608, "metrics": {"mean_ms": 22.379150555000006, "stddev_ms": 1.0602238481286836}, "run": 18, "segment": 8, "status": "keep", "timestamp": 1785087939369}
{"asi": {"evidence": "Nine warmed treatment samples measured 21.61 MB median maximum resident memory versus 23.17 MB across the five-sample control, a 1.56 MB or 6.7 percent reduction. The stable 40-run latency repeat measured 19.21 ms versus the immediate 22.52 ms control. Exact digest-identity tests cover empty, one-byte, and one-megabyte files.", "hypothesis": "Hashing the file-blob prefix and file contents incrementally removes the second one-megabyte buffer and full-file copy from every unchanged requested output.", "next": "Share the measured result with Claude, then reduce immutable AnalysisEngine deep clones for representative large workspaces."}, "commit": "2236ddb", "confidence": 2.6144519378077056, "description": "perf(outputs): stream cached file validation", "metric": 19.205998620000006, "metrics": {"mean_ms": 19.615285770000003, "stddev_ms": 1.2121880667784306}, "run": 19, "segment": 8, "status": "keep", "timestamp": 1785088117013}
{"bestDirection": "lower", "maxIterations": 3, "metricName": "local_hit_ms", "metricUnit": "ms", "name": "Share immutable analysis state", "timestamp": 1785088460863, "type": "config"}
{"asi": {"evidence": "The 15-target fixture has one target kind and should expose only about 75 avoidable allocations; a 500-target workspace with 60 kinds would perform about 64,000 avoidable allocations.", "hypothesis": "Immutable callback metadata, options, and configuration are deep-cloned for each target task even though only the host cache requires shared mutation.", "next": "Restore the shared-ownership treatment and require no regression on the small fixture plus cloned-engine isolation tests."}, "commit": "94f14a3", "confidence": null, "description": "Baseline before shared analysis metadata", "metric": 22.64660018, "metrics": {"mean_ms": 22.933510505, "stddev_ms": 1.8434051032949506}, "run": 20, "segment": 9, "status": "keep", "timestamp": 1785088566028}
{"asi": {"evidence": "Two 40-run treatments measured 24.96 ms and 28.48 ms median versus the 22.65 ms control. The fixture performs only about 75 avoided allocations, and the changed ownership layout consistently lost despite focused correctness tests passing.", "hypothesis": "Sharing immutable callback metadata, analysis options, and configuration would replace per-target deep clones with cheap reference-count increments.", "next": "Keep the existing owned engine fields. Reapply only exact String capacity reservation, then focus on repeated manifest and module loading with direct measurements."}, "commit": "94f14a3", "confidence": null, "description": "Shared analysis metadata regressed the local fixture", "metric": 28.4772052, "metrics": {"mean_ms": 28.756382249999998, "stddev_ms": 2.584386992934817}, "run": 21, "segment": 9, "status": "discard", "timestamp": 1785088701985}
{"bestDirection": "lower", "maxIterations": 2, "metricName": "cold_restore_resident_bytes", "metricUnit": "bytes", "name": "Stream staged output materialization", "timestamp": 1785089427207, "type": "config"}
{"asi": {"evidence": "Nine one-mebibyte cold-materialization samples measured 27,836,416 bytes median maximum resident memory versus 27,852,800 bytes across seven control samples. Resident memory is flat because allocator pages from cache fetch are reused, but source inspection confirms the second full output allocation and copy are removed. All 168 core unit tests, five integration tests, strict linting, and formatting passed.", "hypothesis": "Restoring a prefetched file from its staging path should stream through a fixed-size copy buffer instead of allocating another full blob Vec.", "next": "Prune workspace traversal using safe literal include roots, which should avoid entry allocations and filesystem calls for unrelated trees."}, "commit": "7d7aca3", "confidence": null, "description": "perf(outputs): stream staged file materialization", "metric": 27836416.0, "metrics": {"control_median_bytes": 27852800.0, "samples": 9.0, "treatment_median_bytes": 27836416.0}, "run": 22, "segment": 10, "status": "keep", "timestamp": 1785089427271}
{"bestDirection": "lower", "maxIterations": 3, "metricName": "local_hit_ms", "metricUnit": "ms", "name": "Prune workspace include roots", "timestamp": 1785089445799, "type": "config"}
{"asi": {"evidence": "The 40-run warmed local control measured 20.44 milliseconds median. The benchmark manifest includes only the root once.toml, but the current walker still enters every non-hidden directory.", "hypothesis": "A workspace with literal include roots should not walk unrelated top-level directory trees.", "next": "Derive only provably literal top-level include roots and use them to prune WalkDir without changing wildcard behavior."}, "commit": "0d7764c", "confidence": null, "description": "Baseline before include-root pruning", "metric": 20.43962514, "metrics": {"mean_ms": 20.596615615000008, "stddev_ms": 0.9733106822308418}, "run": 23, "segment": 11, "status": "keep", "timestamp": 1785089470048}
{"asi": {"evidence": "Using the same release executable and a temporary 5,000-branch unrelated tree, 40 runs measured 11.36 milliseconds median with literal-root pruning versus 127.61 milliseconds with an equivalent wildcard include that forces traversal, a 91.1 percent reduction. Wildcard patterns retain full traversal. Focused tests, strict linting, and formatting passed.", "hypothesis": "Workspace traversal can safely prune top-level directories when every include pattern has a literal first component.", "next": "Reserve exact capacity for combined Starlark source and then run the full validation suite."}, "commit": "4634889", "confidence": null, "description": "perf(frontend): prune literal workspace include roots", "metric": 11.3646634, "metrics": {"branches": 5000.0, "mean_ms": 11.475644675, "small_fixture_repeat_ms": 22.50535072, "stddev_ms": 0.644616371, "unpruned_large_workspace_median_ms": 127.61449872}, "run": 24, "segment": 11, "status": "keep", "timestamp": 1785089772810}
